<?xml version="1.0" encoding="UTF-8"?>
<!ELEMENT bibliographie (livre*,article*) >

<!-- LIVRE -->
<!ELEMENT livre (titre, auteur+, tome+, informationLivre) >
<!ELEMENT tome EMPTY >
<!ATTLIST tome nbPage CDATA #REQUIRED >
<!ELEMENT informationLivre (editeur, lieuEdition, lieuImpression)> 
<!ATTLIST informationLivre isbn ID #REQUIRED >
<!ELEMENT editeur (#PCDATA) >
<!ELEMENT lieuEdition (#PCDATA) >
<!ELEMENT lieuImpression (#PCDATA) >

<!-- ARTICLE -->
<!ELEMENT article (titre, auteur+, reference, avisPersonnel?) >
<!ELEMENT reference (nomJournal) >
<!ATTLIST reference numeroPage CDATA #REQUIRED
                    anneePublication CDATA #REQUIRED
                    numeroJournal CDATA #REQUIRED >
<!ELEMENT nomJournal (#PCDATA) >           
<!ELEMENT avisPersonnel (#PCDATA) >

<!-- COMMUN -->
<!ELEMENT titre (#PCDATA) >
<!ELEMENT auteur (#PCDATA) >